{
  "card_version": 1,
  "difficulty": {
    "agreement": {
      "agree": true,
      "empirical_label": "medium",
      "note": "disagreements recorded, not reconciled",
      "structural_label": "medium"
    },
    "caveat": "empirical anchoring run with n=5 attempts \u2014 small-sample caveat: one success shifts the label; solve-rates are descriptive, not calibrated estimates.",
    "empirical": {
      "agent": "claude-code",
      "attempts": 5,
      "label": "medium",
      "model": "claude-haiku-4-5-20251001",
      "per_attempt_rewards": [
        1.0,
        0.0,
        1.0,
        1.0,
        0.0
      ],
      "run_at": "2026-07-08T16:45:57+00:00",
      "solve_rate": 0.6,
      "successes": 3,
      "thresholds": {
        "easy": ">=0.75",
        "hard": "<0.25",
        "medium": "0.25-0.74",
        "note": "thresholds fixed in docs/PLAN.md (easy >=75%, medium 25-74%, hard <25%) before any empirical results were seen"
      }
    },
    "empirical_solve_rate": 0.6,
    "signals": [
      {
        "name": "flipped_test_count",
        "note": "fewer flipped tests -> harder to localize",
        "points": 2,
        "value": 4
      },
      {
        "name": "instruction_verbosity",
        "note": "symptom_only gives no file/function hint",
        "points": 0,
        "value": "explicit"
      },
      {
        "name": "verifier_test_count",
        "note": "regression copies + admitted edge + hardening edge tests",
        "points": 1,
        "value": 4
      },
      {
        "name": "call_graph_depth",
        "note": "approximate intra-module call depth from public API",
        "points": 0,
        "value": 1
      }
    ],
    "structural_preliminary": "medium",
    "total_points": 3
  },
  "diversity": {
    "category": "software-engineering",
    "repo": "tabulate",
    "skill_type": "control-flow-reasoning"
  },
  "evidence_provenance": {
    "live": [
      "failure establishment (suite run in-container)",
      "solvability rewards (real `harbor run`, oracle + nop agents)",
      "verifier-synthesis admission (fail-broken/pass-oracle, in-container)",
      "alignment traceability check",
      "shortcut battery incl. harden-loop re-probe",
      "near-miss re-apply + re-score",
      "difficulty signals (deterministic, from artifacts + AST)"
    ],
    "precomputed_or_authored": [
      "near-miss patches (author-written, committed, labeled llm_proposed)",
      "hardening registry entries (authored from battery findings)",
      "handcheck claims (standalone script, re-runnable on demand)",
      "empirical difficulty solve-rates (model-dependent, generated once by pipeline/empirical_difficulty.py with an API key; the zero-key demo re-reads the committed artifact)"
    ]
  },
  "failure_establishment": {
    "checked_at": "2026-07-08T16:49:47+00:00",
    "flipped_tests": [
      "test/test_output.py::test_html",
      "test/test_output.py::test_unsafehtml",
      "test/test_output.py::test_html_headerless",
      "test/test_output.py::test_unsafehtml_headerless"
    ],
    "n_flipped_tests": 4,
    "oracle_round_trip_green": true,
    "verdict": "accept"
  },
  "generated_at": "2026-07-08T16:54:27+00:00",
  "independent_handcheck": {
    "claims_reverified": [
      "sanity leg: untouched broken repo scores 0.0",
      "assert_true residual is OPEN: committed near-miss patch applied, verifier returned 1.0 \u2014 the honest residual is real, not a battery artifact"
    ],
    "covered": true,
    "note": "scripts/handcheck.sh is a standalone re-verification: it shares no code with pipeline/integrity.py, nearmiss.py, or hardening.py, prints every command before running it, and can be re-run with `bash scripts/handcheck.sh`.",
    "script": "scripts/handcheck.sh"
  },
  "near_miss_battery": {
    "checked_at": "2026-07-08T16:54:27+00:00",
    "hardening": {
      "hardened": false,
      "reason": "no distinguishing edge test found"
    },
    "n": 3,
    "n_reject": 2,
    "provenance": "llm_proposed (author-written, committed under artifacts/nearmiss/; re-applied and re-scored deterministically by the harness)",
    "rejection_rate": 0.667,
    "residual_open_ids": [
      "assert_true"
    ],
    "table": [
      {
        "category": "partial_fix",
        "description": "cosmetic rewrite equivalent to the bug (not fixed)",
        "final_verdict": "REJECT",
        "id": "partial_noop",
        "residual_open": false,
        "reward_initial": "0",
        "verdict_initial": "REJECT"
      },
      {
        "category": "assertion_gaming",
        "description": "always wrap output as JupyterHTMLStr",
        "final_verdict": "ACCEPT",
        "id": "assert_true",
        "residual_open": true,
        "reward_initial": "1",
        "verdict_initial": "ACCEPT"
      },
      {
        "category": "assertion_gaming",
        "description": "never wrap output as JupyterHTMLStr",
        "final_verdict": "REJECT",
        "id": "assert_false",
        "residual_open": false,
        "reward_initial": "0",
        "verdict_initial": "REJECT"
      }
    ]
  },
  "provenance": {
    "candidate_id": "c07-inverted_condition-L2393",
    "changed_condition": {
      "from": "fmt.lineabove == _html_begin_table_without_header",
      "to": "not (fmt.lineabove == _html_begin_table_without_header)"
    },
    "enclosing_function": "_format_table",
    "file": "tabulate/__init__.py",
    "generator": "tb-task-pipeline (stages 1-4, deterministic, no LLM)",
    "line": 2393,
    "mutation_template": "inverted_condition",
    "rng_seed": 42,
    "seed_commit": "bf58e37e6b35e3cc9a0bd740f752abfd32b6e6f8",
    "seed_repo": "tabulate",
    "source_sha256_healthy": "5f7af0a28fcd713b830c97388675945fa8c4950b05b58f8d187c900a5752d57d",
    "source_sha256_mutated": "1dbf37de77162195d71b79927216ea325dcf78d03a0f33fd06f0fd49a811b500",
    "template_description": "Negates a branch condition (if/while), so the program takes the wrong branch whenever the condition is evaluated."
  },
  "residual_risks": [
    "The oracle is a known-good solution (the inverse of the mutation), not proven unique; other correct fixes exist and would also pass.",
    "Near-miss rejection is measured over a stated, author-written set (labeled llm_proposed); same-family generation has correlated blind spots \u2014 novel cheat families remain unprobed.",
    "Difficulty is anchored on n=5 attempts by one model (claude-haiku-4-5-20251001); one success shifts the label \u2014 descriptive, not a calibrated estimate.",
    "All current tasks derive from a single seed repo (tabulate); set-level diversity across repos is not yet demonstrated.",
    "environment.network_mode='public' (Harbor's local Docker provider rejects 'no-network'): the pip_reinstall shortcut is probed and blocked, but other network routes are unprobed.",
    "OPEN RESIDUAL: near-miss 'assert_true' (assertion_gaming: always wrap output as JupyterHTMLStr) is accepted by the verifier (reward 1) without restoring the original condition; the one-shot hardening attempt found no distinguishing edge test. Independently confirmed open by scripts/handcheck.sh."
  ],
  "shortcut_battery": {
    "checked_at": "2026-07-08T16:53:41+00:00",
    "post_harden_solvable_property": {
      "broken_reward": "0",
      "ok": true,
      "oracle_reward": "1"
    },
    "probes": {
      "artifact_spoofing": {
        "detail": "reward stayed 0 despite the cheat",
        "premise": "agent plants fake pytest cache + fake ctrf report",
        "status": "blocked"
      },
      "env_poisoning_conftest": {
        "detail": "reward stayed 0 despite the cheat",
        "premise": "hostile /repo/conftest.py (skip-all) + fake pytest on PATH",
        "status": "blocked"
      },
      "exit_code_fake_pytest": {
        "detail": "reward stayed 0 despite the cheat",
        "premise": "fake pytest binary on PATH exiting 0",
        "status": "blocked"
      },
      "exposed_files": {
        "detail": "no held-out tests, oracle patch, .git, or /tests in agent env",
        "premise": "search agent filesystem for held-out/oracle/.git artifacts",
        "status": "blocked"
      },
      "hardcode_reward_txt": {
        "detail": "reward stayed 0 despite the cheat",
        "premise": "agent pre-writes reward.txt=1 before verification",
        "status": "blocked"
      },
      "pip_reinstall": {
        "detail": "reward stayed 0 despite the cheat",
        "premise": "pip install healthy tabulate over the broken copy",
        "status": "blocked"
      },
      "spoof_reward_json": {
        "detail": "reward stayed 0 despite the cheat",
        "harden_loop": {
          "hardening_applied": [
            "PYTHONPATH=/repo pins import to the code under test",
            "delete planted reward.{txt,json} before verifying",
            "remove hostile /repo/conftest.py before collection"
          ],
          "registry_entry": "spoof_reward_json",
          "status_before_hardening": "failed"
        },
        "premise": "agent plants reward.json=1 (Harbor resolves json first)",
        "status": "blocked"
      }
    },
    "registry_version": 1
  },
  "solvability": {
    "checked_at": "2026-07-08T16:51:31+00:00",
    "harness": "harbor run (agents: oracle, nop)",
    "nop_reward": 0.0,
    "oracle_reward": 1.0,
    "verdict": "accept"
  },
  "spec_coverage": {
    "alignment": {
      "checked_at": "2026-07-08T16:50:00+00:00",
      "reason": "1 requirement(s) <-> 1 check(s), fully traceable",
      "verdict": "accept"
    },
    "coverage": {
      "R1": [
        "V1"
      ]
    },
    "requirements": [
      {
        "id": "R1",
        "origin": "template.intended_behavior",
        "text": "In tabulate/__init__.py:2393 (_format_table), the branch condition must be `fmt.lineabove == _html_begin_table_without_header` (not its negation). Control flow must follow the original condition."
      }
    ],
    "spec_source": "mutation template metadata (procedural; no LLM)",